69240866;ROPINIROLE ZENTIVA LP;comprimé pelliculé à libération prolongée;1;ropinirole|2|mg;1;chlorhydrate de ropinirole||;CCFDE42E53E5AB5A930108B326950BFBBB2A5BB2;ROPINIROLE ZENTIVA LP 2 mg, comprimé pelliculé à libération prolongée
69610283;PIPORTIL;solution buvable;0;1;pipotiazine|4|g;CA9781987B8FB8DFAF192FB732F4BF428C2CE3FB;PIPORTIL 4 POUR CENT, solution buvable
62474215;EFAVIRENZ/EMTRICITABINE/TENOFOVIR DISOPROXIL MYLAN;comprimé pelliculé;1;ténofovir disoproxil|245|mg;3;éfavirenz|600|mg;emtricitabine|200|mg;maléate de ténofovir disoproxil||;C4FB514022BC8959D55DB04445E555941258B82D;EFAVIRENZ/EMTRICITABINE/TENOFOVIR DISOPROXIL MYLAN 600 mg/200 mg/245 mg, comprimé pelliculé
67628724;ENTECAVIR ZYDUS;comprimé pelliculé;1;entécavir|1|mg;1;entécavir monohydraté||;75D281525719D8CF7D08FAFEBE9BCFE952BE236C;ENTECAVIR ZYDUS 1 mg, comprimé pelliculé
62476853;TRACTOCILE;solution injectable;1;atosiban|6,75|mg;1;acétate d'atosiban||;3989E9F8F7137CF5F2B8F17585AB09CA4F15288C;TRACTOCILE 6,75 mg/0,9 ml, solution injectable
63380434;REMIFENTANIL MYLAN;poudre pour solution injectable ou pour perfusion;1;rémifentanil base|5|mg;1;chlorhydrate de rémifentanil||;245E825615C8EB50F6AA788F08DB15D57707912F;REMIFENTANIL MYLAN 5 mg, poudre pour solution injectable ou pour perfusion
60996271;SERTRALINE ZYDUS FRANCE;gélule;1;sertraline base|50|mg;1;chlorhydrate de sertraline||;6F3966F59095219409E2C6CF636B7CD83D8F1FA4;SERTRALINE ZYDUS FRANCE 50 mg, gélule
66172723;HEDERA HELIX LEHNING;comprimé et solution(s) et granules et poudre et pommade;0;1;hedera helix pour préparations homéopathiques|2CH à 30CH et 4DH à 60DH (pommade à 1 %, 4 % ou 10 %)|;40F05277B077754F451A213565F5165A9630BEBB;HEDERA HELIX LEHNING, degré de dilution compris entre 2CH et 30CH ou entre 4DH et 60DH
62294199;MONOXYDE D'AZOTE MESSER;gaz;0;1;monoxyde d'azote|800 ppm (V/V)|;BFE6F73672800D7AE81629A1CA5B8F904340555B;MONOXYDE D'AZOTE MESSER 800 PPM (V/V), gaz médicinal comprimé
61335351;PREDNISOLONE ARROW;comprimé effervescent(e) sécable;1;prednisolone|20|mg;1;métasulfobenzoate sodique de prednisolone||;34528BF21351051DF261AA91DBB656E324B16D67;PREDNISOLONE ARROW 20 mg, comprimé effervescent sécable
64500662;LISINOPRIL ACTAVIS;comprimé sécable;1;lisinopril anhydre|20|mg;1;lisinopril dihydraté||;5FD1CFA880DB669BAC075B4243545CF807297C7E;LISINOPRIL ACTAVIS 20 mg, comprimé sécable
62620809;ESCITALOPRAM ARROW;comprimé pelliculé sécable;1;escitalopram|15|mg;1;oxalate d'escitalopram||;AB1094A6CF240F88A9BC7FB13F543F7095F18A4C;ESCITALOPRAM ARROW 15 mg, comprimé pelliculé sécable
66039826;PODOPHYLLUM PELTATUM LEHNING;comprimé et solution(s) et granules et poudre et pommade;0;1;podophyllum peltatum pour préparations homéopathiques|2CH à 30CH et 4DH à 60DH (pommade à 1 %, 4 % ou 10 %)|;E9C1F19FBA1BA94347DB25D1AC81711D06A62B84;PODOPHYLLUM PELTATUM LEHNING, degré de dilution compris entre 2CH et 30CH ou entre 4DH et 60DH
63331572;VITASCORBOL;comprimé effervescent(e);0;1;acide ascorbique|1|g;127DCFE33CBA2BE8F86F3AB8B89F87302D73D4AA;VITASCORBOL 1 g, comprimé effervescent
68524034;KALIUM BROMATUM LEHNING;comprimé et solution(s) et granules et poudre et pommade;0;1;kalium bromatum pour préparations homéopathiques|2CH à 30CH et 4DH à 60DH (pommade à 1 %, 4 % ou 10 %)|;08B98F853C4730E113DCF35E697D5A04F4A0DCC2;KALIUM BROMATUM LEHNING, degré de dilution compris entre 2CH et 30CH ou entre 4DH et 60DH
65881757;CEFTRIAXONE ACTAVIS;poudre et  solvant pour solution injectable;1;ceftriaxone base|1|g;1;ceftriaxone sodique||;9150B3CD60801C916DDB1F3D795A429DDF724DA1;CEFTRIAXONE ACTAVIS 1 g/3,5 ml, poudre et solvant pour solution injectable (IM, SC)
62866789;IMIPENEM/CILASTATINE ARROW;poudre pour solution pour perfusion;2;imipénem anhydre|500|mg;cilastatine anhydre|500|mg;2;imipénem monohydraté||;cilastatine sodique||;8871D5A6A4A99E6BAAE36F507037E178232D860D;IMIPENEM/CILASTATINE ARROW 500 mg/500 mg, poudre pour solution pour perfusion
67505091;KALIUM BROMATUM WELEDA;granules et  poudre et  solution en gouttes en gouttes;0;1;kalium bromatum pour préparations homéopathiques|2CH à 30CH et 4DH à 60DH|;2ECF26E59011DBDA00A0F9AC493ABEEB8F480045;KALIUM BROMATUM WELEDA, degré de dilution compris entre 2CH et 30CH ou entre 4DH et 60DH
67353986;MERONEM;poudre pour solution injectable ou pour perfusion;1;méropénem anhydre|1000,00|mg;1;méropénem trihydraté||;C939B5B9067DDE7C0219CF88BE4D0D587CAECF23;MERONEM 1 g, poudre pour solution injectable ou pour perfusion
66977744;PEVARYL;poudre pour application;0;1;nitrate d'éconazole|1|g;F83349CF3013E0191B3B815CD7A5E1704CCE5384;PEVARYL 1 POUR CENT, poudre pour application locale en flacon poudreur
69407984;GRAPHITES LEHNING;comprimé et solution(s) et granules et poudre et pommade;0;1;graphites pour préparations homéopathiques|2CH à 30CH et 4DH à 60DH (pommade à 1 %, 4 % ou 10 %)|;43B4D71B8157A964A6C3F773200354A8FED0D608;GRAPHITES LEHNING, degré de dilution compris entre 2CH et 30CH ou entre 4DH et 60DH
63344872;ESOMEPRAZOLE ARROW;gélule gastro-résistant(e);1;ésoméprazole|20|mg;1;ésoméprazole magnésique dihydraté||;7A348BB17F0861FF541C03C8BA18FDE450E3E14D;ESOMEPRAZOLE ARROW 20 mg, gélule gastro-résistante
65981280;SALBUTAMOL ARROW;solution pour inhalation par nébuliseur;1;salbutamol|5|mg;1;sulfate de salbutamol||;A1943E932B80610FA603DEADA9C78B332FEF0C7F;SALBUTAMOL ARROW 5 mg/2,5 ml, solution pour inhalation par nébuliseur en récipient unidose
64489810;AMOXICILLINE MYLAN PHARMA;poudre pour suspension buvable;1;amoxicilline anhydre|125|mg;1;amoxicilline trihydratée||;8C9B492763AB8E20DF0C78733FE0F752828D9956;AMOXICILLINE MYLAN PHARMA 125 mg/5 ml, poudre pour suspension buvable
65651521;FOSRENOL;comprimé à croquer;1;lanthane|750|mg;1;carbonate de lanthane hydraté||;FB3C75D6311571E986C346E23E723FB32297C16E;FOSRENOL 750 mg, comprimé à croquer
68046787;MENVEO;poudre et  solution pour solution injectable;0;4;oligoside de neisseria meningitidis du groupe w135 conjugué à la protéine crm197|5|µg d'oligoside de Neisseria meningitidis du groupe W135;neisseria meningitidis du groupe a (oligoside de) conjugué à la protéine crm197|10|µg d'oligoside de Neisseria meningitidis du groupe A;oligoside de neisseria meningitidis du groupe c conjugué à la protéine crm197|5|µg d'oligoside de Neisseria meningitidis du groupe C;oligoside de neisseria meningitidis du groupe y conjugué à la protéine crm197|5|µg d'oligoside de Neisseria meningitidis du groupe Y;5D9FA9F2989FD5AA2C957D0D54007D87902C6C2C;MENVEO, poudre et solution pour solution injectable. Vaccin méningococcique des groupes A, C, W-135 et Y conjugué
65578258;IPECA LEHNING;comprimé et solution(s) et granules et poudre et pommade;0;1;ipéca pour préparations homéopathiques|2CH à 30CH et 4DH à 60DH (pommade à 1 %, 4 % ou 10 %)|;2C643DF3EBD5AF7FC8CA24610F9030576378089D;IPECA LEHNING, degré de dilution compris entre 2CH et 30CH ou entre 4DH et 60DH
61984083;GLUCOSE;solution pour perfusion;1;glucose anhydre|10|g;1;glucose monohydraté||;67EDE1691D8FAFF77AB86B306CC8EB0ADAE04EDE;GLUCOSE 10 % BAXTER, solution pour perfusion
60276708;CADMIUM SULFURICUM BOIRON;comprimé et solution(s) et granules et poudre et pommade;0;1;cadmium sulfuricum pour préparations homéopathiques|4CH à 30CH et 8DH à 60DH (pommade à 4 %)|;215D8FD35A1D42D81F455E0981BF317EEF214CFC;CADMIUM SULFURICUM BOIRON, degré de dilution compris entre 4CH et 30CH ou entre 8DH et 60DH
69624856;TERBINAFINE ISOMED;comprimé sécable;1;terbinafine|250|mg;1;chlorhydrate de terbinafine||;5E19AA2834B0089D7B0A88C3CEACA74FFE3A313D;TERBINAFINE ISOMED 250 mg, comprimé sécable
65472835;SANTANE;plante(s) pour tisane en vrac;0;5;feuille de mélisse|15|g;passiflore|17|g;aubépine (sommité fleurie d')|20|g;houblon (cone de)|8|g;tilleul (inflorescence de)|20|g de mélange de fleur et de bractée;FCB542AAD1432466B74E5CBBF1C069ADA956C4CE;SANTANE N9, mélange de plantes pour tisane en vrac
62246425;FOLINATE DE CALCIUM AGUETTANT;poudre pour solution injectable;1;acide folinique|350|mg;1;folinate de calcium||;F2D606643461F311682633C42549DF0AB7C7B6C9;FOLINATE DE CALCIUM AGUETTANT 350 mg, poudre pour solution injectable
63271239;DROSERA COMPLEXE N;solution buvable en gouttes;0;10;coccus cacti pour préparations homéopathiques|3 DH 3|ml;viola odorata pour préparations homéopathiques|T.M 3|ml;drosera pour préparations homéopathiques|2 DH 3|ml;belladona pour préparations homéopathiques|3 DH 3|ml;pulsatilla pour préparations homéopathiques|3 DH 3|ml;thymus vulgaris pour préparations homéopathiques|3 DH 3|ml;ipéca pour préparations homéopathiques|4 DH 3|ml;veratrum album pour préparations homéopathiques|8 DH 3|ml;lobelia inflata pour préparations homéopathiques|3 DH 3|ml;cuprum aceticum pour préparations homéopathiques|4 DH 3|ml;3A445331CECB91D1AA30BE52C7AEF32ED39A5503;DROSERA COMPLEXE N°64, solution buvable en gouttes
67570979;CLOPIDOGREL RATIOPHARM;comprimé pelliculé;1;clopidogrel|75|mg;1;bésilate de clopidogrel||;300B45653ABFC3BB1758F48B64ED03F0534194D8;CLOPIDOGREL RATIOPHARM GmbH 75 mg, comprimé pelliculé
62889478;OCTREOSCAN;solution et  poudre pour injection;0;2;pentétréotide|10|microgrammes;indium [111 in] (chlorure d')|122 MBq à|la date et heure de calibration;6F5B382B347268F273142D2B4CCF51A0390EBDB3;OCTREOSCAN, poudre et solution pour injection
63992157;GRANOCYTE;poudre et  solvant;0;1;lénograstim|33,6 Millions|UI (263 microgrammes);766740D0BCB1F095B016A31D34E108B8151D879D;GRANOCYTE 34 Millions UI/ML, poudre et solvant pour solution injectable/perfusion en seringue préremplie
69347658;CALCAREA PHOSPHORICA LEHNING;comprimé et solution(s) et granules et poudre et pommade;0;1;calcarea phosphorica pour préparations homéopathiques|2CH à 30CH et 4DH à 60DH (pommade à 1 %, 4 % ou 10 %)|;7CF3C6A472BCED3F1BE0D8F5B13BA79148F54E4C;CALCAREA PHOSPHORICA LEHNING, degré de dilution compris entre 2CH et 30CH ou entre 4DH et 60DH
61299147;LISINOPRIL MYLAN;comprimé sécable;1;lisinopril anhydre|5|mg;1;lisinopril dihydraté||;3F8570A87BE91A248A7B79540DBEDF252BB61438;LISINOPRIL MYLAN 5 mg, comprimé sécable
63416987;CLOXACILLINE BIOGARAN;gélule;1;cloxacilline|500|mg;1;cloxacilline sodique monohydratée||;76842EBB35E9B275A97B6D026B33C59A3784A633;CLOXACILLINE BIOGARAN 500 mg, gélule
60491130;DAFLON;comprimé pelliculé;0;1;fraction flavonoïque purifiée micronisée|500|mg dont 450 mg de diosmine et 50 mg de flavonoïdes exprimés en hespéridine;66AAEF97273EF5C88CA91FBA6F90DD07F039A231;DAFLON 500 mg, comprimé pelliculé
61203595;IVABRADINE ARROW;comprimé pelliculé sécable;1;ivabradine|5|mg;1;chlorhydrate d'ivabradine||;A1A5D35BDB5B2FE26B9175C5EAA723A7CD6F762B;IVABRADINE ARROW 5 mg, comprimé pelliculé sécable
65958869;SOLUBACTER;solution pour application;0;1;triclocarban|1|g;05FF7CA575FD482B6C33C0396C51C37111C0A13B;SOLUBACTER 1 POUR CENT, solution pour application locale
62304120;IMATINIB EG;comprimé pelliculé;1;imatinib|400|mg;1;mésilate d'imatinib||;734EFFFA57C5A99624773FB6862F1263D0F73AFB;IMATINIB EG 400 mg, comprimé pelliculé
65460861;AMOXICILLINE ZYDUS;gélule;1;amoxicilline anhydre|500|mg;1;amoxicilline trihydratée||;933291BFD371EB998EF24C637C63FA9C86DE371D;AMOXICILLINE ZYDUS 500 mg, gélule
65982507;PREGABALINE HCS;gélule;0;1;prégabaline|25|mg;3606177C4DD5F68441D071E5C0E79E2337B2D779;PREGABALINE HCS 25 mg, gélule
66409371;ESCITALOPRAM SANDOZ;comprimé pelliculé sécable;1;escitalopram|20|mg;1;oxalate d'escitalopram||;78DD439D20CDD1B98C4EE4D14BCFE55555D8A728;ESCITALOPRAM SANDOZ 20 mg, comprimé pelliculé sécable
68888721;BERBERIS AQUIFOLIUM BOIRON;comprimé et solution(s) et granules et poudre et pommade;0;1;berberis aquifolium pour préparations homéopathiques|2CH à 30CH et 4DH à 60DH (pommade à 4 %)|;FFF4D210B1363B1911B4D4581BACC329A98FB1F8;BERBERIS AQUIFOLIUM BOIRON, degré de dilution compris entre 2CH et 30CH ou entre 4DH et 60DH
64210260;GRAZAX;lyophilisat;0;1;extrait allergénique de pollen de fléole des prés|75 000 SQ-T|;0E5C9149F1AAA251034C28B2E42161513778941C;GRAZAX 75 000 SQ-T, lyophilisat oral
67567399;QUETIAPINE RANBAXY LP;comprimé à libération prolongée;1;quétiapine|300|mg;1;fumarate de quétiapine||;4A83B14CDEC81041C17DE3DC9FF8B84EE8BE1D67;QUETIAPINE RANBAXY LP 300 mg, comprimé à libération prolongée
65108237;RANITIDINE SANDOZ;comprimé effervescent(e);1;ranitidine base|300|mg;1;ranitidine (chlorhydrate de)||;8AA85CD4BE6813F89D56FE607CF0D17262912350;RANITIDINE SANDOZ 300 mg, comprimé effervescent
61889646;SYMPHYTUM OFFICINALE BOIRON;comprimé et solution(s) et granules et poudre et pommade;0;1;symphytum officinale pour préparations homéopathiques|3CH à 30CH et 5DH à 60DH (pommade à 4%)|;47CAC9BCA4D1B88F58886D891DE3A0E8EACC6C96;SYMPHYTUM OFFICINALE BOIRON, degré de dilution compris entre 3CH à 30CH et 5DH à 60 DH
64657756;PAROXETINE ZYDUS;comprimé pelliculé sécable;1;paroxétine base|20,000|mg;1;chlorhydrate de paroxétine hémihydraté||;08973A9E19FED5584E03C6DE42B8617109733B12;PAROXETINE ZYDUS 20 mg, comprimé pelliculé sécable
61017669;SILDENAFIL EG;comprimé pelliculé;1;sildénafil|20|mg;1;citrate de sildénafil||;6BD77CDB8847DDBBF46AFCDD5D73E25A56637A63;SILDENAFIL EG 20 mg, comprimé pelliculé
64048303;MILLEFOLIUM WELEDA;granules et  crème et  solution en gouttes en gouttes;0;1;millefolium pour préparations homéopathiques|2CH à 30CH et 4DH à 60DH (crème à 4 %)|;B19004BBFD2A67059EDA694D3840A971A09D3124;MILLEFOLIUM WELEDA, degré de dilution compris entre 2CH et 30CH ou entre 4DH et 60DH
64714100;OLICLINOMEL N;émulsion et  solution et  solution pour perfusion;2;glucose anhydre|125|g;lysine|2,9|g;18;histidine|2,4|g;huile de soja raffinée|environ 6|g;phénylalanine|2,8|g;chlorhydrate de lysine|3,62|g;méthionine|2|g;sérine|2,5|g;proline|3,4|g;leucine|3,65|g;glycine|5,15|g;arginine|5,75|g;glucose monohydraté|137,5|g;alanine|10,35|g;valine|2,9|g;thréonine|2,1|g;huile d'olive raffinée|environ 24|g;tryptophane l|0,9|g;tyrosine|0,2|g;isoleucine|3|g;C21C6E91C5AB89152E2A8C31F23B900EA1108406;OLICLINOMEL N 8-800, émulsion pour perfusion
69742178;FLUOXETINE MYLAN;comprimé dispersible sécable;1;fluoxétine base|20|mg;1;chlorhydrate de fluoxétine||;A577F8D057DF4C36124B7AF6E5C321F63C21E795;FLUOXETINE MYLAN 20 mg, comprimé dispersible sécable
67351316;KALIUM PHOSPHORICUM BOIRON;comprimé et solution(s) et granules et poudre et pommade;0;1;kalium phosphoricum pour préparations homéopathiques|2CH à 30CH et 4DH à 60DH (pommade à 4 %)|;789801B117D2581BC3F5E9D4B33D893E60FD06D5;KALIUM PHOSPHORICUM BOIRON, degré de dilution compris entre 2CH et 30CH ou entre 4DH et 60DH
65760638;DEROXAT;suspension buvable;1;paroxétine base|20|mg;1;chlorhydrate de paroxétine hémihydraté||;D67206FD1656038488F9AF195425587BB5EED84C;DEROXAT 20 mg/10 ml, suspension buvable
69345098;DERINOX;solution pour pulvérisation;0;2;prednisolone|20|mg;nitrate de naphazoline|25|mg;2979FFBF55F563286FF96C65D1F2EE0B7AC9F399;DERINOX, solution pour pulvérisation nasale
61228851;EPOPROSTENOL SANDOZ;poudre et  solvant pour solution pour perfusion;1;époprosténol|1,500|mg;1;époprosténol sodique||;169178EBDDCB7EA38D4E30169F1F9F96B7783889;EPOPROSTENOL SANDOZ 1,5 mg, poudre et solvant pour solution pour perfusion
64035035;TROPAEOLUM MAJUS BOIRON;comprimé et solution(s) et granules et poudre et pommade;0;1;tropaeolum majus pour préparations homéopathiques|2CH à 30CH et 4DH à 60DH (pommade à 4 %)|;5E5BA96078F4487AB735B9FE52F096777B9BEE2D;TROPAEOLUM MAJUS BOIRON, degré de dilution compris entre 2CH et 30CH ou entre 4DH et 60DH
62197024;IMETH;solution injectable;1;méthotrexate|25|mg;1;méthotrexate disodique||;0F40CC90DF502774A25874EF45650B2AB223DE71;IMETH 15 mg/0,6 ml, solution injectable en seringue préremplie
64606174;OXYGENE MEDICINAL SOMAL;gaz pour inhalation;0;1;oxygène|qs (sous une pression de 200 bar)|;66420F9C9C26F3448B1BDC1E2E5C25F6325158B7;OXYGENE MEDICINAL SOMAL 200 bar, gaz pour inhalation, en bouteille
69466146;TAHOR;comprimé pelliculé;1;atorvastatine|40|mg;1;atorvastatine calcique trihydratée||;F9017550EBD8EC589F7C0BBDD302B4F060796D2D;TAHOR 40 mg, comprimé pelliculé
63490820;DELTAZINE;solution injectable pour usage dentaire;1;adrénaline|0,010|mg;2;tartrate d'adrénaline||;articaïne (chlorhydrate d')|40|mg;54DB8780E5AB954B989F05A3CC2507C3DE1F1332;DELTAZINE 40 mg/ml ADRENALINEE AU 1/100 000, solution injectable à usage dentaire
67274478;SEREVENT;suspension pour inhalation;1;salmétérol base|25|microgrammes;1;xinafoate de salmétérol||;C974A7276F6B2B9B37CB07BF1EBEB7CFFDB0161F;SEREVENT 25 microgrammes par dose, suspension pour inhalation en flacon pressurisé
68719828;GLECHOMA HEDERACEA BOIRON;comprimé et solution(s) et granules et poudre et pommade;0;1;glechoma hederacea pour préparations homéopathiques|2CH à 30CH et 4DH à 60DH (pommade à 4 %)|;54793B38F6EEE4726B337C94964974AB5A7CAEEF;GLECHOMA HEDERACEA BOIRON, degré de dilution compris entre 2CH et 30CH ou entre 4DH et 60DH
67626068;CADMIUM SULFURICUM LEHNING;comprimé et solution(s) et granules et poudre et pommade;0;1;cadmium sulfuricum pour préparations homéopathiques|4CH à 30CH et 8DH à 60DH (pommade à 1 %, 4 % ou 10 %)|;2AFC59175A39D629F26441035DDAEE7E931C4643;CADMIUM SULFURICUM LEHNING, degré de dilution compris entre 4CH et 30CH ou entre 8DH et 60DH
63906140;LISINOPRIL MYLAN PHARMA;comprimé sécable;1;lisinopril anhydre|5|mg;1;lisinopril dihydraté||;3F8570A87BE91A248A7B79540DBEDF252BB61438;LISINOPRIL MYLAN PHARMA 5 mg, comprimé sécable
63451237;INEXIUM;granulés gastro-résistant(e) pour suspension buvable;1;ésoméprazole|10|mg;1;ésoméprazole magnésique trihydraté||;B78C2B0DC8C66C1140799132A38CEF5C08081EB3;INEXIUM 10 mg, granulés gastro-résistants pour suspension buvable en sachet
61901618;CEFTRIAXONE BIOGARAN;poudre et  solvant pour solution injectable;1;ceftriaxone base|1|g;1;ceftriaxone sodique||;9150B3CD60801C916DDB1F3D795A429DDF724DA1;CEFTRIAXONE BIOGARAN 1 g/10 ml, poudre et solvant pour solution injectable (IV)
62089244;CARBOLICUM ACIDUM BOIRON;comprimé et solution(s) et granules et poudre et pommade;0;1;carbolicum acidum pour préparations homéopathiques|2CH à 30CH et 4DH à 60DH  (pommade à 4 %)|;E1EC20BB6FA6D1231185ABA6612CBB2572BA8C13;CARBOLICUM ACIDUM BOIRON, degré de dilution compris entre 2CH et 30CH ou entre 4DH et 60DH
67448861;AMOXICILLINE/ACIDE CLAVULANIQUE TEVA SANTE;poudre pour suspension buvable;2;amoxicilline anhydre|100|mg;clavulanique (acide)|12,50|mg;2;clavulanate de potassium||;amoxicilline trihydratée||;17ABF9BE345B842297DF2D50982888FEEB03BC65;AMOXICILLINE/ACIDE CLAVULANIQUE TEVA SANTE 100 mg/12,50 mg par ml NOURRISSONS, poudre pour suspension buvable en flacon (Rapport amoxicilline/acide clavulanique: 8/1)
66375339;FLUOXETINE EG;comprimé dispersible sécable;1;fluoxétine base|20,00|mg;1;chlorhydrate de fluoxétine||;8D8C688DD0DC294836CAFAF4B04E36859FD1F155;FLUOXETINE EG 20 mg, comprimé dispersible sécable
62439972;OXYGENE MEDICINAL LIQUIDE SAGA MEDICAL;gaz pour inhalation;0;1;oxygène|qs (sous une pression|inférieure ou égale à 12 bar, de -180 à 150 °C );C67F1FDD4DA29938C505044DA8973D1848B53B8C;OXYGENE MEDICINAL LIQUIDE SAGA MEDICAL, gaz pour inhalation, en évaporateur mobile et en récipient cryogénique mobile
67423566;IMATINIB MYLAN;comprimé pelliculé;1;imatinib|400|mg;1;mésilate d'imatinib||;734EFFFA57C5A99624773FB6862F1263D0F73AFB;IMATINIB MYLAN 400 mg, comprimé pelliculé
68875332;VELBE;poudre pour solution injectable;1;vinblastine anhydre|10|mg;1;sulfate de vinblastine||;DC4F368C3B96ABB6832A4F4B0D1A65723D86A977;VELBE 10 mg, poudre pour solution injectable I.V.
64550843;AMOXICILLINE ACIDE CLAVULANIQUE ALMUS;poudre pour suspension buvable;2;amoxicilline anhydre|100|mg;clavulanique (acide)|12,5|mg;2;clavulanate de potassium||;amoxicilline trihydratée||;3390A421C50834E5A69E427EEF0843CC1D082BFC;AMOXICILLINE ACIDE CLAVULANIQUE ALMUS 100 mg/12,5 mg par ml ENFANTS, poudre pour suspension buvable (rapport amoxicilline/acide clavulanique : 8/1)
68333157;AURUM METALLICUM LEHNING;comprimé et solution(s) et granules et poudre et pommade;0;1;aurum metallicum pour préparations homéopathiques|2CH à 30CH et 4DH à 60DH (pommade à 1 %, 4 % ou 10 %)|;A7D45E169BB65E83959AEDD7B89FEDC8DCE239C8;AURUM METALLICUM LEHNING, degré de dilution compris entre 2CH et 30CH ou entre 4DH et 60DH
69200035;PREDNISOLONE TEVA;comprimé effervescent(e);1;prednisolone|5|mg;1;métasulfobenzoate sodique de prednisolone||;2D3E468864DF69D5F7EDFAD6E9BF4E16A8660D77;PREDNISOLONE TEVA 5 mg, comprimé effervescent
61610071;FERULA COMMUNIS BOIRON;comprimé et solution(s) et granules et poudre et pommade;0;1;ferula communis pour préparations homéopathiques|2CH à 30CH et 4DH à 60DH (pommade à 4%)|;F48F0740EAC466EFD980C9E4E9F077F07A65BC65;FERULA COMMUNIS BOIRON, degré de dilution compris entre 2CH à 30CH et 4DH à 60DH
66325208;DESCOVY;comprimé pelliculé;1;ténofovir alafénamide|25|mg;2;fumarate de ténofovir alafénamide||;emtricitabine|200|mg;F6A55AF2AF2BF85B65ACB9AB6750B49D491B29A6;DESCOVY 200 mg/25 mg, comprime pellicule
65907376;ATORVASTATINE MYLAN;comprimé pelliculé;1;atorvastatine|40|mg;1;atorvastatine calcique trihydratée||;F9017550EBD8EC589F7C0BBDD302B4F060796D2D;ATORVASTATINE MYLAN 40 mg, comprimé pelliculé
69756861;VELCADE;poudre pour solution injectable;1;bortézomib|1|mg;1;ester boronique de mannitol||;680A7791CD4F580F2CB8386456696E24DD0402E4;VELCADE 1 mg, poudre pour solution injectable
63560628;ECONAZOLE SANDOZ;crème;0;1;nitrate d'éconazole|1|g;ADAB4DE1CC76864D36D94D6071866B0686EFF8EB;ECONAZOLE SANDOZ 1 POUR CENT, crème
66064765;AMMONIUM MURIATICUM BOIRON;comprimé et solution(s) et granules et poudre et pommade;0;1;ammonium muriaticum pour préparations homéopathiques|2CH à 30CH et 4DH à 60DH (pommade à 4 %)|;2A913C7D3F2262FCB187A026E5158AA2D63264F5;AMMONIUM MURIATICUM BOIRON, degré de dilution compris entre 2CH et 30CH ou entre 4DH et 60DH
65602428;XELEVIA;comprimé pelliculé;1;sitagliptine|100|mg;1;phosphate de sitagliptine monohydraté||;F04EB3BFFE295AD7C4A912A35CF59A92D87142A2;XELEVIA 100 mg, comprimé pelliculé
62424059;NEGABAN;poudre pour solution injectable ou pour perfusion;1;témocilline|1|g;1;témocilline disodique|1,11|g;1F29AFE8286A85DF38FDD107D6BD505AF6D22005;NEGABAN 1 g, poudre pour solution injectable ou pour perfusion
66916798;AMOXICILLINE ARROW LAB;gélule;1;amoxicilline anhydre|500|mg;1;amoxicilline trihydratée||;933291BFD371EB998EF24C637C63FA9C86DE371D;AMOXICILLINE ARROW LAB 500 mg, gélule
60817925;LEVODOPA/CARBIDOPA/ENTACAPONE EG;comprimé pelliculé;1;carbidopa|12,50|mg;3;lévodopa|50|mg;carbidopa monohydratée||;entacapone|200|mg;6E4D4D88B54AC16769A67266464ADB0420645357;LEVODOPA/CARBIDOPA/ENTACAPONE EG 50 mg/12.5 mg/200 mg, comprimé pelliculé
61707595;SANDOSTATINE;solution injectable pour perfusion;1;octréotide|0,5|mg;1;acétate d'octréotide||;7F48CDF5F6C1E2E2F892C4322018B90110D571B0;SANDOSTATINE 500 microgrammes/1 mL, solution injectable/pour perfusion
65074589;IMATINIB CRISTERS;comprimé pelliculé sécable;1;imatinib|100|mg;1;mésilate d'imatinib||;03C503BC6757A32F393015A67F10A17C3977D389;IMATINIB CRISTERS 100 mg, comprimé pelliculé sécable
66881532;VALGANCICLOVIR ARROW;comprimé pelliculé;1;valganciclovir|450|mg;1;chlorhydrate de valganciclovir||;23E3D7C2FA5CB528B0D544100849F0B9695B2678;VALGANCICLOVIR ARROW 450 mg, comprimé pelliculé
60672497;GALANTAMINE ARROW LP;gélule à libération prolongée;1;galantamine|16|mg;1;bromhydrate de galantamine||;7C5CBE4E9EBF2811566396775FBDF521EBA3F373;GALANTAMINE ARROW LP 16 mg, gélule à libération prolongée
66086110;QUETIAPINE ARROW LP;comprimé à libération prolongée;1;quétiapine|300|mg;1;fumarate de quétiapine||;4A83B14CDEC81041C17DE3DC9FF8B84EE8BE1D67;QUETIAPINE ARROW LP 300 mg, comprimé à libération prolongée
63366057;ATORVASTATINE SANDOZ;comprimé pelliculé;1;atorvastatine|80|mg;1;atorvastatine calcique||;4F06B7085FD8797D7460E0323475EFD92BFA7407;ATORVASTATINE SANDOZ 80 mg, comprimé pelliculé
67699080;LEVOFLOXACINE ARROW LAB;comprimé pelliculé sécable;1;lévofloxacine|500|mg;1;lévofloxacine hémihydratée||;60BED8BDBC9D7162C8EFEA1C6A1BFC8AD6E40108;LEVOFLOXACINE ARROW LAB 500 mg, comprimé pelliculé sécable
60418577;DULCAMARA LEHNING;comprimé et solution(s) et granules et poudre et pommade;0;1;dulcamara pour préparations homéopathiques|2CH à 30CH et 4DH à 60DH (pommade à 1 %, 4 % ou 10 %)|;2DA1DD43AD582246B7EBA2C5A6D38A49BAF29008;DULCAMARA LEHNING, degré de dilution compris entre 2CH et 30CH ou entre 4DH et 60DH
65567767;VIVELLEDOT;dispositif;1;bêta-estradiol|0,78|mg;1;bêta-estradiol hémihydraté||;28559AA95620C1DE7E9E179CB7E1307DABADD571;VIVELLEDOT 50 microgrammes/24 heures, dispositif transdermique
62450285;CIPROFLOXACINE MYLAN;comprimé pelliculé;1;ciprofloxacine|500|mg;1;chlorhydrate de ciprofloxacine||;E31DD00FCCF6147234F2709E95851864D8028FF1;CIPROFLOXACINE MYLAN 500 mg, comprimé pelliculé sécable
61289886;VENLAFAXINE BIPHAR;comprimé à libération prolongée;1;venlafaxine|75|mg;1;chlorhydrate de venlafaxine||;E37326A1442B6B4882921A79599D82EC8ACD6346;VENLAFAXINE BIPHAR 75 mg, comprimé à libération prolongée
63874803;ESCITALOPRAM SANDOZ;comprimé pelliculé sécable;1;escitalopram|15|mg;1;oxalate d'escitalopram||;AB1094A6CF240F88A9BC7FB13F543F7095F18A4C;ESCITALOPRAM SANDOZ 15 mg, comprimé pelliculé sécable
65157330;AMLODIPINE RANBAXY;gélule;1;amlodipine|5,00|mg;1;bésilate d'amlodipine||;1E9A7F6D666FD9E7177B526731C5B49FC9714613;AMLODIPINE RANBAXY 5 mg, gélule
66460565;TASIGNA;gélule;1;nilotinib|200|mg;1;chlorhydrate de nilotinib monohydraté||;2F122989520BB6D9A7136E2FAA7C18D0932DD4FE;TASIGNA 200 mg, gélule
